контекст,snippet_x,snippet_y,category_id,маркер
"В конечном итоге явно моделировать перекрытия выгоднее, чем закладывать возможность перекрытия в обучающие данные распознающего алгоритма, поскольку в случае явного моделирования система будет ориентироваться только на непрерывные перекрытия соседних частей объекта, в то время как для алгоритма без априорных знаний одинаково возможны как непрерывные перекрытия, так и несвязные перекрытия отдельных частей объекта, которые невозможны в действительности.","В конечном итоге явно моделировать перекрытия выгоднее, чем закладывать возможность перекрытия в обучающие данные распознающего алгоритма, поскольку в случае явного моделирования система будет ориентироваться только на непрерывные перекрытия соседних частей объекта,","в то время как для алгоритма без априорных знаний одинаково возможны как непрерывные перекрытия, так и несвязные перекрытия отдельных частей объекта, которые невозможны в действительности.",comparison_m,в то время как
"В рамках системного подхода конфликт трактуют как комплементарное, знаковое или комплементарно-знаковое противоречие, в котором оба противоположных отношения одновременно истинны. В литературе чаще всего его определяют как противоборство сторон, преследующих несовместимые цели.","В рамках системного подхода конфликт трактуют как комплементарное, знаковое или комплементарно-знаковое противоречие, в котором оба противоположных отношения одновременно истинны.","В литературе чаще всего его определяют как противоборство сторон, преследующих несовместимые цели.",comparison_m,nd
"Конфликт понимают как дисбаланс внутренних и/или внешних отношений системы. В литературе чаще всего его определяют как противоборство сторон, преследующих несовместимые цели.",Конфликт понимают как дисбаланс внутренних и/или внешних отношений системы.,"В литературе чаще всего его определяют как противоборство сторон, преследующих несовместимые цели.",comparison_m,nd
"а Гайворонский и Пфлуг вводят специальную «сглаженную» версию рискового капитала (Gaivoronski A., Pflug G. Op.cit.). 16. В частности, в работе: Campbell R, Huisman R, Koedijk K. Op. cit. предполагается t-распределение Стьюдента, ","а Гайворонский и Пфлуг вводят специальную «сглаженную» версию рискового капитала (Gaivoronski A., Pflug G. Op.cit.).","16. В частности, в работе: Campbell R, Huisman R, Koedijk K. Op. cit. предполагается t-распределение Стьюдента, ",comparison_m,nd
"чем больше скорость вращения ротора. и тем больше,",чем больше скорость вращения ротора.,"и тем больше,",comparison_m,чем… тем
"а параметрическая е -инвариантность характеризуется заметной величиной е. что выход системы не обладает абсолютной параметрической инвариантностью,",а параметрическая е -инвариантность характеризуется заметной величиной е.,"что выход системы не обладает абсолютной параметрической инвариантностью,",comparison_m,а
"Следует отметить, что если известны матрицы А, В, Л, Н , то уравнение (3) решается относительно матрицы М , а если известны А,В, Л, М , то уравнение (3) решается относительно матрицы Н в форме [формула].","Следует отметить, что если известны матрицы А, В, Л, Н , то уравнение (3) решается относительно матрицы М ,","а если известны А,В, Л, М , то уравнение (3) решается относительно матрицы Н в форме [формула].",comparison_m,а
"а по результатам сравнения данных показателей с показателем, рассчитанным при идеально функционирующей, гипотетической, системе МС (с его критериальным значением, установленным для решаемой задачи), выводится абсолютная оценка исследуемых вариантов.  По результатам сравнения показателей эффективности объекта управления производится относительная оценка вариантов организации или построения СМС,","а по результатам сравнения данных показателей с показателем, рассчитанным при идеально функционирующей, гипотетической, системе МС (с его критериальным значением, установленным для решаемой задачи), выводится абсолютная оценка исследуемых вариантов.","По результатам сравнения показателей эффективности объекта управления производится относительная оценка вариантов организации или построения СМС,",comparison_m,а
"Частичная оптимизация по результатам последовательного анализа становится возможной благодаря разбиению процесса синтеза систем на ряд стадий, что обеспечивает уменьшение размерности решаемой задачи [9]. При этом необходимо иметь в виду, что оптимизируемым объектом может быть не система в целом, а лишь та или иная ее характеристика. Именно в случае, когда процесс формирования сложных систем проходит ряд стадий, и возникает потребность в такой частичной оптимизации. Вместе с тем общая оптимизация становится возможной потому, что в процессе формирования системы происходит постепенная, т. е. поэтапная ее оптимизация на основе последовательного анализа.","Частичная оптимизация по результатам последовательного анализа становится возможной благодаря разбиению процесса синтеза систем на ряд стадий, что обеспечивает уменьшение размерности решаемой задачи [9]. При этом необходимо иметь в виду, что оптимизируемым объектом может быть не система в целом, а лишь та или иная ее характеристика. Именно в случае, когда процесс формирования сложных систем проходит ряд стадий, и возникает потребность в такой частичной оптимизации.","Вместе с тем общая оптимизация становится возможной потому, что в процессе формирования системы происходит постепенная, т. е. поэтапная ее оптимизация на основе последовательного анализа.",comparison_m,вместе с тем
"хорошо совпадающими по форме с кривой исходного контура  и в то же время инвариантными относительно изменения масштаба, количества измерений, уровня помех.",хорошо совпадающими по форме с кривой исходного контура ,"и в то же время инвариантными относительно изменения масштаба, количества измерений, уровня помех.",comparison_m,и в то же время
"а атомарная формула с отрицанием называется отрицательным литералом. Литералом называется атомарная формула,",а атомарная формула с отрицанием называется отрицательным литералом.,"Литералом называется атомарная формула,",comparison_m,а
"Преимуществами указанного типа моделей являются: \- простота и ясность основной единицы - продукционного правила; \- независимость продукций и легкость модификации баз знаний; \- строгость, простота и изученность механизма логического вывода; \- эффективность логического вывода. К недостаткам можно отнести: \- малую степень структурированности базы знаний; \- неуниверсальность.","Преимуществами указанного типа моделей являются: \- простота и ясность основной единицы - продукционного правила; \- независимость продукций и легкость модификации баз знаний; \- строгость, простота и изученность механизма логического вывода; \- эффективность логического вывода.",К недостаткам можно отнести: \- малую степень структурированности базы знаний; \- неуниверсальность.,comparison_m,nd
"Связи представляют собой ссылки от одного тикета к другому и могут иметь следующие типы: «has clone», «duplicates», «introduces», «incorporates», «relates». Симметричными им являются соответственно: «clone of», «is duplicated by», «introduced by», «is incorporated by», «is related to».","Связи представляют собой ссылки от одного тикета к другому и могут иметь следующие типы: «has clone», «duplicates», «introduces», «incorporates», «relates».","Симметричными им являются соответственно: «clone of», «is duplicated by», «introduced by», «is incorporated by», «is related to».",comparison_m,являться симметричным
"а на её последующую синхронизацию потребуется уже гораздо меньшее количество времени. Первичная запись локальной базы данных на ноутбук происходит в течение нескольких часов,",а на её последующую синхронизацию потребуется уже гораздо меньшее количество времени.,"Первичная запись локальной базы данных на ноутбук происходит в течение нескольких часов,",comparison_m,а
"в случае же больших объемов данных, которые требуют регулярной синхронизации, необходимо использовать Web SQL. Перечисленные подходы дают возможность хранить незначительные объемы данных при помощи Web Storage (html-код, cookies, css и т. д.),","в случае же больших объемов данных, которые требуют регулярной синхронизации, необходимо использовать Web SQL.","Перечисленные подходы дают возможность хранить незначительные объемы данных при помощи Web Storage (html-код, cookies, css и т. д.),",comparison_m,в случае же 
"Рассматривая мобильную версию МИС компании «Информационно-медицинский центр», можно отметить её широкие возможности, но отсутствие возможности работы без сети не позволяет использовать ее для решения поставленной задачи. В результате исследования рынка имеющихся продуктов, позволяющих решить имеющуюся проблему, были выявлены как непосредственно положительные, так и отрицательные стороны. К положительным, безусловно, относится возможность МИС «Кондопога» и «Медиалог» работать в режиме офлайн и в дальнейшем синхронизировать информацию с сервером, но приложения доступны только для персональных компьютеров или же ноутбуков систем Windows. Для организации же работы врача скорее приемлем планшет или смартфон в связи с их мобильностью.","Рассматривая мобильную версию МИС компании «Информационно-медицинский центр», можно отметить её широкие возможности, но отсутствие возможности работы без сети не позволяет использовать ее для решения поставленной задачи.","В результате исследования рынка имеющихся продуктов, позволяющих решить имеющуюся проблему, были выявлены как непосредственно положительные, так и отрицательные стороны. К положительным, безусловно, относится возможность МИС «Кондопога» и «Медиалог» работать в режиме офлайн и в дальнейшем синхронизировать информацию с сервером, но приложения доступны только для персональных компьютеров или же ноутбуков систем Windows. Для организации же работы врача скорее приемлем планшет или смартфон в связи с их мобильностью.",comparison_m,nd
"• WebSQL представляет из себя полномерную SQL - базу данных внутри браузера, которая может хранить копии данных веб-приложения для автономной работы, позволяя пользователям продолжить работу с данными даже при потере соединения с сетью. Данные синхронизируются с сервером при последующем подключении к сети [9]. • Application Cache дает возможность хранить элементы веб-приложения (HTML, CSS и т. д.) для их последующего использования в моменты, когда сеть будет недоступна; • Web Storage основан на механизмах хранения, аналогичных cookies, но при этом представляет собой более гибкую и более мощную их реализацию;","• WebSQL представляет из себя полномерную SQL - базу данных внутри браузера, которая может хранить копии данных веб-приложения для автономной работы, позволяя пользователям продолжить работу с данными даже при потере соединения с сетью. Данные синхронизируются с сервером при последующем подключении к сети [9].","• Application Cache дает возможность хранить элементы веб-приложения (HTML, CSS и т. д.) для их последующего использования в моменты, когда сеть будет недоступна; • Web Storage основан на механизмах хранения, аналогичных cookies, но при этом представляет собой более гибкую и более мощную их реализацию;",comparison_m,nd
"а общим недостатком - отсутствие в СЗИ средств, обеспечивающих накопление и обобщение опыта взаимодействия корпоративной сети с внешней средой и нейтрализации внутрисистемных угроз. Общей чертой существующих систем защиты информации является наличие отдельных средств идентификации (задача классификации) угроз, выявления и устранения уязвимостей и оперативной реакции на несанкционированные проникновения в корпоративную сеть,","а общим недостатком - отсутствие в СЗИ средств, обеспечивающих накопление и обобщение опыта взаимодействия корпоративной сети с внешней средой и нейтрализации внутрисистемных угроз.","Общей чертой существующих систем защиты информации является наличие отдельных средств идентификации (задача классификации) угроз, выявления и устранения уязвимостей и оперативной реакции на несанкционированные проникновения в корпоративную сеть,",comparison_m,а
"В случае если h(D) совпадает с h(D''), принимаем что таблица D' совпадает с исходной таблицей ПДн D, и загружаем ее в ОЗУ для дальнейшей работы. В противном случае, если полученное хэш-значение h(D) не совпало АЛГОРИТМ КОНТРОЛЯ ЦЕЛОСТНОСТИ ДЕПЕРСОНАЛИЗИРОВАННЫХ . с h(D ), алгоритм должен выдать сообщение оператору о том, что была нарушена целостность файла с деперсонализированными данными.","В случае если h(D) совпадает с h(D''), принимаем что таблица D' совпадает с исходной таблицей ПДн D, и загружаем ее в ОЗУ для дальнейшей работы.","В противном случае, если полученное хэш-значение h(D) не совпало АЛГОРИТМ КОНТРОЛЯ ЦЕЛОСТНОСТИ ДЕПЕРСОНАЛИЗИРОВАННЫХ . с h(D ), алгоритм должен выдать сообщение оператору о том, что была нарушена целостность файла с деперсонализированными данными.",comparison_m,в противном случае
"горизонтальная фрагментация - разделение отношения на подмножества таким образом, что каждое подмножество содержит полный набор атрибутов. Вертикальная фрагментация - это разделение атрибутов на группы,","горизонтальная фрагментация - разделение отношения на подмножества таким образом, что каждое подмножество содержит полный набор атрибутов.","Вертикальная фрагментация - это разделение атрибутов на группы,",comparison_m,nd
"Целью первичной горизонтальной фрагментации является оптимизация операций над множествами, позволяющая, во-первых, сузить пространство поиска и, во-вторых, обеспечить возможность параллельного выполнения операций. Целью же вторичной горизонтальной фрагментации является повышение скорости навигационных операций, достигаемое за счет объединения множеств объектов различных типов.","Целью первичной горизонтальной фрагментации является оптимизация операций над множествами, позволяющая, во-первых, сузить пространство поиска и, во-вторых, обеспечить возможность параллельного выполнения операций.","Целью же вторичной горизонтальной фрагментации является повышение скорости навигационных операций, достигаемое за счет объединения множеств объектов различных типов.",comparison_m,же
"как карты из кластера Б будут изменять оценку карт из кластера А), (т.е. карты из кластера А будут изменять оценку карт из кластера Б не так,","как карты из кластера Б будут изменять оценку карт из кластера А),","(т.е. карты из кластера А будут изменять оценку карт из кластера Б не так,",comparison_m,"не так, как"
