контекст,snippet_x,snippet_y,category_id,маркер
"Определение С. В. Гринева является примером лаконичной и емкой характеристики термина, для него «термин - это номинативная специальная лексическая единица специального языка, применяемая для точного наименования специальных понятий» [1, с. 33]. В. М. Лейчик давал следующее определение термину: «Термин -лексическая единица определенного языка для специальных целей, обозначающая общее - конкретное или абстрактное - понятие теории определенной специальной области знаний или деятельности» [2, с. 32].","Определение С. В. Гринева является примером лаконичной и емкой характеристики термина, для него «термин - это номинативная специальная лексическая единица специального языка, применяемая для точного наименования специальных понятий» [1, с. 33].","В. М. Лейчик давал следующее определение термину: «Термин -лексическая единица определенного языка для специальных целей, обозначающая общее - конкретное или абстрактное - понятие теории определенной специальной области знаний или деятельности» [2, с. 32].",comparison_m,
"Так, например, слова: referee I судья или basket I корзина являются полностью соотнесенными терминами, так как они дают единственное возможное значение в специальном языке спортивного комментария, в то время как flank I фланг на поле, draw I сыграть вничью или steal I перехват, являясь полисемантичными словами, предоставляют возможность выбора [4].","Так, например, слова: referee I судья или basket I корзина являются полностью соотнесенными терминами, так как они дают единственное возможное значение в специальном языке спортивного комментария,","в то время как flank I фланг на поле, draw I сыграть вничью или steal I перехват, являясь полисемантичными словами, предоставляют возможность выбора [4].",comparison_m,в то время как
"Второй вариант перевода: Eine Fliege - klein und rege Mit 'nem guldern glanzend Bauch, Fand ganz unvermittelt auf dem Wege Eine Mnze und hob sie auf. Первый вариант перевода: Es fliegt die Fliege Suse Sum Voll Neugier in der Luft herum. Sie sieht was glnzen dort im Feld Und hebt es auf - das ist ja Geld! [9, S. 3].","Второй вариант перевода: Eine Fliege - klein und rege Mit 'nem guldern glanzend Bauch, Fand ganz unvermittelt auf dem Wege Eine Mnze und hob sie auf.","Первый вариант перевода: Es fliegt die Fliege Suse Sum Voll Neugier in der Luft herum. Sie sieht was glnzen dort im Feld Und hebt es auf - das ist ja Geld! [9, S. 3].",comparison_m,первый вариант... второй вариант
"При этом французский переводчик сохранил рифму внутри номинации,  в то время как немецкий переводчик ограничился боле свободной формой, имитирующей производимый насекомым звук.","При этом французский переводчик сохранил рифму внутри номинации, ","в то время как немецкий переводчик ограничился боле свободной формой, имитирующей производимый насекомым звук.",comparison_m,в то время как
"В первом варианте происходит транспозиция образа: позолоченное брюхо становится блестящей денежкой: was glnzen dort im Feld - что-то блестит на поле;  в других вариантах - либо золотым отсветом - aux reflets d'or, либо сверкающим золотом брюшком -guldern glanzendBauch.",В первом варианте происходит транспозиция образа: позолоченное брюхо становится блестящей денежкой: was glnzen dort im Feld - что-то блестит на поле; ,"в других вариантах - либо золотым отсветом - aux reflets d'or, либо сверкающим золотом брюшком -guldern glanzendBauch.",comparison_m,в первом варианте... в других вариантах
"то, что в одной культуре является базовой ценностью,  в другой может оказаться вспомогательной, и наоборот.","то, что в одной культуре является базовой ценностью, ","в другой может оказаться вспомогательной, и наоборот.",comparison_m,в одной... в другой
"Во французском тексте мы отмечаем также наличие большого числа эквивалентных соответствий. Приведем пример: Вдруг откуда ни возьмись Маленький комарик А в руке его горит Маленький фонарик [8, с. 5]. Tout coup, apparait dans l'air Un moustique; Le sabre au ct, il a l'air Hroque... [10, p. 6]. Мы констатируем, что в тексте перевода минимальное количество словарных соответствий. В результате межъязыковых трансформаций переводчик заменил фонарик саблей, а сам комарик в переводе назван героическим. Комар предстает героем и в немецком варианте сказки: «Ruhm und Ehre dem Auserwhlten, Dem Brutigam, dem Mckenhelden!» [9, S. 10]. Переводчик сохранил общий тон фрагмента - неожиданное появление комара, летящего навстречу Мухе-Цокотухе и спасающего ее.","Во французском тексте мы отмечаем также наличие большого числа эквивалентных соответствий. Приведем пример: Вдруг откуда ни возьмись Маленький комарик А в руке его горит Маленький фонарик [8, с. 5]. Tout coup, apparait dans l'air Un moustique; Le sabre au ct, il a l'air Hroque... [10, p. 6]. Мы констатируем, что в тексте перевода минимальное количество словарных соответствий. В результате межъязыковых трансформаций переводчик заменил фонарик саблей, а сам комарик в переводе назван героическим.","Комар предстает героем и в немецком варианте сказки: «Ruhm und Ehre dem Auserwhlten, Dem Brutigam, dem Mckenhelden!» [9, S. 10]. Переводчик сохранил общий тон фрагмента - неожиданное появление комара, летящего навстречу Мухе-Цокотухе и спасающего ее.",comparison_m,
"Автор поясняет, что аксиологические ценности принадлежат глубинным структурам, они виртуальны, а идеологические ценности актуализируются в речевой коммуникации.","Автор поясняет, что аксиологические ценности принадлежат глубинным структурам, они виртуальны,",а идеологические ценности актуализируются в речевой коммуникации.,comparison_m,а
"Вьетнамские студенты утверждают, что употребление в речи пословиц и поговорок свойственно в большей мере людям старшего поколения и жителям деревни, занятым коллективным трудом на рисовых полях,  в отличие от русской метафорической, образной речи не только городских улиц, но и российских СМИ.","Вьетнамские студенты утверждают, что употребление в речи пословиц и поговорок свойственно в большей мере людям старшего поколения и жителям деревни, занятым коллективным трудом на рисовых полях, ","в отличие от русской метафорической, образной речи не только городских улиц, но и российских СМИ.",comparison_m,в отличие от
"Пословиц, выражающих даже сходный смысл в русской фразеологии, не обнаружено. Noi dong d nu, chong xu d sai [31] (= В медной кастрюле легко варить, некрасивым мужем легко командовать","Пословиц, выражающих даже сходный смысл в русской фразеологии, не обнаружено.","Noi dong d nu, chong xu d sai [31] (= В медной кастрюле легко варить, некрасивым мужем легко командовать",comparison_m,сходный
"Горы и реки изменить легко, характер человека - трудно. Cha me sinh con, trai sinh tnh [23] (= Отец и мать рождают сына, небо - характер","Горы и реки изменить легко, характер человека - трудно.","Cha me sinh con, trai sinh tnh [23] (= Отец и мать рождают сына, небо - характер",comparison_m,nd
"Перевод вьетнамской пословицы Cha no, con ny (= Каков отец, таков сын [9]) соответствует русским: Каков батька, таковы и детки; Какова хата, таков и тын, каков отец, таков и сын; Яблоко от яблоньки недалеко катится; Каков пень, таков и отростень; Какова матка, таковы и детки [14].","Перевод вьетнамской пословицы Cha no, con ny (= Каков отец, таков сын [9])","соответствует русским: Каков батька, таковы и детки; Какова хата, таков и тын, каков отец, таков и сын; Яблоко от яблоньки недалеко катится; Каков пень, таков и отростень; Какова матка, таковы и детки [14].",comparison_m,соответствовать
"Вьет. Day con t thud con tha, day va t thud ba va mai v [24] (= Учи ребенка, пока он мал, учи жену, пока она только начала супружескую жизнь (Перевод Нгуен Тхи Тхуи Чам)) близка по смыслу русским Учи ребенка, пока поперек лавки лежит; Не учили поперёк лавочки, а во всю вытянулся - не научишь; Учи жену без детей, а детей без людей [11].","Вьет. Day con t thud con tha, day va t thud ba va mai v [24] (= Учи ребенка, пока он мал, учи жену, пока она только начала супружескую жизнь (Перевод Нгуен Тхи Тхуи Чам))","близка по смыслу русским Учи ребенка, пока поперек лавки лежит; Не учили поперёк лавочки, а во всю вытянулся - не научишь; Учи жену без детей, а детей без людей [11].",comparison_m,близок
"Вьетнамская пословица Me day con khe, cha day con khn [30] (= Мать учит - дети ловкие, отец учит -дети умные (Перевод Доан Тхи Кам Чьеу)) формирует поле смыслов об отношениях родителей и детей. Русские пословицы Родители трудолюбивы - и дети не ленивы [14]; Родительское благословение на воде не тонет, на огне не горит [4] не могут считаться эквивалентными вьетнамским, потому что в них не дифференцирована роль отца и матери в воспитании детей, хотя единство темы следует все же признать.","Вьетнамская пословица Me day con khe, cha day con khn [30] (= Мать учит - дети ловкие, отец учит -дети умные (Перевод Доан Тхи Кам Чьеу)) формирует поле смыслов об отношениях родителей и детей.","Русские пословицы Родители трудолюбивы - и дети не ленивы [14]; Родительское благословение на воде не тонет, на огне не горит [4] не могут считаться эквивалентными вьетнамским, потому что в них не дифференцирована роль отца и матери в воспитании детей, хотя единство темы следует все же признать.",comparison_m,считаться эквивалетными
"Русские пословицы на заданную вьетнамской пословицей тему отличаются лексической образностью и стилистикой: Для такого характера и сатана не пугало [14]; Послушному сыну отцов приказ не ломит спину; Не учил сына, поколе поперек лавочки укладывался, а как во всю вытянулся, не научишь; Не учила сына, когда кормила, а тебя кормить станет, так не научишь [4]. Cha me sinh con, trai sinh tnh [23] (= Отец и мать рождают сына, небо - характер (Перевод Ву Хыу Куиет)); Горы и реки изменить легко, характер человека - трудно.","Русские пословицы на заданную вьетнамской пословицей тему отличаются лексической образностью и стилистикой: Для такого характера и сатана не пугало [14]; Послушному сыну отцов приказ не ломит спину; Не учил сына, поколе поперек лавочки укладывался, а как во всю вытянулся, не научишь; Не учила сына, когда кормила, а тебя кормить станет, так не научишь [4].","Cha me sinh con, trai sinh tnh [23] (= Отец и мать рождают сына, небо - характер (Перевод Ву Хыу Куиет)); Горы и реки изменить легко, характер человека - трудно.",comparison_m,отличаться
"G cng mot me ch hoi nhau [26] (= Цыплята одной матери не ссорятся (Перевод Нгуен Тхи Тхуи Чам)). В русских пословицах В дружной семье и в холод тепло; Мир в семье женой держится; Согласную семью беды обходят; При солнышке тепло - при матери добро; Дитя плачет, а у матери сердце болит; Детушек воспитать - не курочек пересчитать [14] - при тематической близости отсутствует общая, необходимая для эквивалентов образность, и даже в последней пословице смысловой акцент делается на роли матери, а не на миролюбии деточек,",G cng mot me ch hoi nhau [26] (= Цыплята одной матери не ссорятся (Перевод Нгуен Тхи Тхуи Чам)).,"В русских пословицах В дружной семье и в холод тепло; Мир в семье женой держится; Согласную семью беды обходят; При солнышке тепло - при матери добро; Дитя плачет, а у матери сердце болит; Детушек воспитать - не курочек пересчитать [14] - при тематической близости отсутствует общая, необходимая для эквивалентов образность, и даже в последней пословице смысловой акцент делается на роли матери, а не на миролюбии деточек,",comparison_m,при близости
"Большинство вышеперечисленных признаков характерны и для немецкоязычного дискурса. Представления об идеальной женщине также связаны с такими понятиями, как привлекательность, сексуальность, женственность, чувственность, элегантность, уникальность. Таким образом, наиболее характерными чертами образа идеальной женщины русскоязычного рекламного парфюмерного дискурса являются: привлекательность, сексуальность, женственность, чувственность, элегантность, гламурность, уверенность в себе, неповторимость и уникальность.","Большинство вышеперечисленных признаков характерны и для немецкоязычного дискурса. Представления об идеальной женщине также связаны с такими понятиями, как привлекательность, сексуальность, женственность, чувственность, элегантность, уникальность.","Таким образом, наиболее характерными чертами образа идеальной женщины русскоязычного рекламного парфюмерного дискурса являются: привлекательность, сексуальность, женственность, чувственность, элегантность, гламурность, уверенность в себе, неповторимость и уникальность.",comparison_m,характерный
"Однако в отличие от русскоязычной рекламы мы не обнаружили образов, созданных на основе представлений о гламурной диве,  в немецкой рекламе значительно преобладает образ женщины независимой и самостоятельной. При этом образ немецкой идеальной женщины - это не только уверенная в себе и энергичная дама, но и женщина- лидер, занимающая ведущую позицию в обществе.","Однако в отличие от русскоязычной рекламы мы не обнаружили образов, созданных на основе представлений о гламурной диве, ","в немецкой рекламе значительно преобладает образ женщины независимой и самостоятельной. При этом образ немецкой идеальной женщины - это не только уверенная в себе и энергичная дама, но и женщина- лидер, занимающая ведущую позицию в обществе.",comparison_m,в отличие от X
"Научный характер текста - в том, что он содержит художественные термины (название стилей и направлений в искусстве, материалов, техник, элементов рисунка и оборудования) и стилистически нейтральную лексику. Публицистичность искусствоведческого текста проявляется в наличии большого количества фактов, имен, дат.","Научный характер текста - в том, что он содержит художественные термины (название стилей и направлений в искусстве, материалов, техник, элементов рисунка и оборудования) и стилистически нейтральную лексику.","Публицистичность искусствоведческого текста проявляется в наличии большого количества фактов, имен, дат.",comparison_m,
"переводная искусствоведческая литература до 1990-го года выполняла идеологическую функцию (как и все прочие издания),  а, начиная с 90-х, основной функцией становится дополнительная. Переводная литература как бы дополняет отечественное искусствоведческое знание [3, с. 178].","переводная искусствоведческая литература до 1990-го года выполняла идеологическую функцию (как и все прочие издания), ","а, начиная с 90-х, основной функцией становится дополнительная. Переводная литература как бы дополняет отечественное искусствоведческое знание [3, с. 178].",comparison_m,а
