контекст,snippet_x,snippet_y,category_id,маркер
,"Рифменная позиция делает неологизм заметнее, структурно и фонетически выделяет его.","Однако для того чтобы с полной уверенностью делать такое утверждение, нужно проанализировать отмеченность авторских слов не только с количественной, но и с качественной точки зрения.",Contrast,однако
,"Выражение да ты с польцой понимается в этом контексте как причисление к польской нации,","но благодаря слову трусца, оно приобретает оттенок неодобрительного значения. Все имена существительные, образованные от прилагательных с помощью суффикса -ц, (ср.: гнильца, хитреца, хрипотца, ленца), обладают негативным экспрессивным ореолом.",Contrast,но
,"то статистика не столь значима,","нужны, напротив, языковые прецеденты для различных типов рифм-неологизмов.",Contrast,напротив
,"Из них в рифменную позицию, согласно нашим подсчетам, помещены 49,1 % (1084 слова), зарифмованы но расположены в середине или в начале строки 27,8 % (614 слов).",Не зарифмованы 23 % (508 слов).,Contrast,no marker
,"Некоторые из них употребляются только один раз,",другие — несколько раз.,Contrast,no marker
,"«Поэтический неологизм» или «авторское слово», как неоднократно отмечала Л. В. Зубова, является более удачным термином, чем «окказиональное слово», потому что, в отличие от него, не привносит этимологического значения оценочности5. Окказионализм — случайное слово (от англ. occasional — случайный).","В поэтическом языке М. Цветаевой неологизмы — не случайное, а системное явление, они органично включены в языковую картину мира поэта, раскрывают особенности поэтического мышления, помогают понять особенности эстетического отношения поэта к слову.",Contrast,no marker
,"Из-за фонетической близости неологизмов и комбинации разных типов рифм, в том числе диссонансных, сложно уловить, какое слово с каким именно перекликается.","Скорее возникает ощущение, что все слова связаны повторением общих фонетических комплексов, содержащих суффикс -щин, окончание -е, но с разными ударными гласными.",Contrast,скорее
,"Трусца вне приведенного контекста воспринимается как узуальное слово, обозначающее неторопливый бег, мелкую рысь11.",Но в данном случае трусцой зарифмовано с польцой.,Contrast,но
,"где рифма не нужна,","а неологизм нужен,",Contrast,не ... а
,В литературном языке денотативная отнесенность слова чучело определяется по контексту.,"Но М. Цветаева дает его с диалектно-просторечной флексией женского рода винительного падежа -у, тем самым унифицируя его с предыдущим рядом слов.",Contrast,но
,"Мысль о том, что фонетическая орфография - «идеал, к которому должны стремиться все языки», теоретически прекрасна,","«но, как часто бывает, она расходится с практикой и едва ли осуществима», т.к. почти «везде письмо не в точности следует за произношением»: азбука, будучи заимствованной у другого народа, в большинстве случаев не вполне отвечает звукам языка [11, с. 634-635].",Contrast,но
,"предписывалось отменить двойные согласные в иноязычных словах, например, писать асимиляция, дисимиляция, иригация, корозия; удвоение сохранялось в словах ванна, гамма, сумма,",но список слов считался еще не окончательным.,Contrast,но
,"Являясь сторонником упрощения русского правописания, В. И. Даль выступает за искоренение удвоенных согласных как противных русскому языку и потому не воспроизводимых в речи. Причины использования удвоенных согласных в языке видятся им: 1) в тщеславии: «мы знаем все языки»; 2) в невежестве: «мы не знаем своего» [4, с. 24].","Возражая ему, Я. К. Грот отмечает, что это мнение может быть справедливым лишь в отношении церковнославянского или древнерусского языка. «Нынешний язык, напротив того, показывает во многих случаях склонность к удвоению согласных», которое «происходит в нем либо по закону образования слов, либо по безотчетному требованию слуха» [2, с. 86].",Contrast,no marker
,"Для слов, которые произносятся с долгими согласными, необходимо оставить старое написание,","но таких заимствований немного,",Contrast,но
,"Описывая произношение лексем с консонантным удвоением не на стыке морфем, С. М. Кузьмина выделяет словоформы, произносимые: 1) только с согласным нормальной длительности: аппетит, суббота, терраса, класс, программный; 2) только с долгим согласным: ванна, тонна, касса, сумма; 3) «и с долгим согласным, и с согласным нормальной длительности» даже в речи одного лица: группа, программа, пропеллер, аллегро, эффект.","Но такое разделение носит условный характер и в исследованиях разных авторов «произношение одних и тех же слов оценивается по-разному» [6, с. 51].",Contrast,но
,"Принятие нового свода правил, несомненно, упростило бы работу по орфографии новых слов, ","но в русском языке довольно большое количество заимствований, которые освоены языком,",Contrast,но
,"Большинство иноязычных слов, заимствованных еще в петровскую эпоху, утратило удвоение согласных.","Но в то же время «в старинных заимствованиях» иногда сохраняется удвоение, например, аттестат, коллегия [Там же].",Contrast,но
,"Одни из предписаний академика закрепились в языке,","другие, так и не были восприняты языковой практикой и, вопреки рекомендациям ученого, остались на периферии истории языка.",Contrast,no marker
,"можно встретить также вариант аппарта- мент, слово индиферентизм (от лат. indifferens (indifferentis)),","хотя часто писали индифферентизм, в котором Я. К. Грот, один из кодификаторов русского правописания, призывал не удваивать букву ф, т.к. удвоение в таких словах исчезло, и нет необходимости его восстанавливать.",Concession,хотя
,"он может быть представлен как долгим, так и кратким произносительным вариантом.","Несмотря на то, что графически удвоенный согласный занимает сильную позицию,",Concession,несмотря на X
,"можно встретить также вариант аппарта- мент, слово индиферентизм (от лат. indifferens (indifferentis)),","хотя часто писали индифферентизм,",Concession,хотя
,остались на периферии истории языка.,"вопреки рекомендациям ученого,",Concession,вопреки X
,"Это было допустимо для перевода 1930-го года,","но в новой редакции следовало привести современные написания имен (Хугован дер Гус вместо Фан дер Гус, Вермеер вместо Фермер), унифицировать наименования, привести текст в соответствие с современным искусствознанием, сопроводить разъясняющими комментариями.",Contrast,но
,"Последовательно реализовать эту позицию сейчас достаточно сложно, поскольку у нас нет отчетливого представления о том, в чем же заключается общественное благо.","Но признание данного факта не означает автоматического перехода на либеральную позицию. Более того, реформы нашего образования ведут к коммодификации образования, то есть к концептуализации образования в терминах «товар» и «услуга».",Contrast,но
,"В современном открытом обществе роль образования меняется, оно становится важнейшим лифтом социальной мобильности, то есть культурный капитал может стать средством получения экономического и политического капитала.","Однако при всей внешней доступности образования мы говорим прежде всего о высшем образовании, есть серьезные препятствия на пути его получения, их можно определить как «классовый этос». «Классовый этос» - это система латентных ценностей, интериоризированных людьми с детства» [5, с. 278]. Каждый социальный слой создает свой мир, стиль жизни, со своими ценностными предпочтениями. Вырастая в определенной среде, человек усваивает ее культуру, привыкает к ней и в дальнейшем соизмеряет свои жизненные цели с доминантами «своей» культуры. Если в низших слоях нет ценности интеллектуальной деятельности, понимания значимости образования, то дети из этих слоев не будут стремиться к получению знаний. Более того, возникшее желание подняться выше может быть сведено на нет трудностями адаптации к новому окружению.",Contrast,однако
,"Разумеется, мы сконструировали идеальную образовательную модель, реализуемую на практике с определенными оговорками и допущениями.","Но именно этот идеал задает целеполагание, делает педагогический труд осмысленным, творческим, спасая от давления повседневности.",Contrast,но
,"Есть некие фундаментальные образовательные объекты, онтологические сущности, концентрирующие в себе бытийную реальность. Это природные, культурные объекты, определяемые для каждой познавательной области, представляющие собой набор категорий, законов и принципов, которые ученик должен усвоить как некую научную данность.","Но есть сферы знания, допускающие личностное отношение, когда ученик может объединить социокультурный и собственный субъективный опыт в понимании некоего определенного феномена, т. е. он сам найдет ответы на сформулированные учителем эвристически значимые вопросы, сам придет к неким выводам.",Contrast,но
,Современное русское литературное произношение сложилось на основе устной речи Москвы XIX в.,"Однако на почве местных языковых особенностей в различных регионах нашей страны сформировался родной говор, одним из важнейших признаков которого является отступление от норм литературного языка.",Contrast,однако
,"Возможно, это и так,","но когда мы оказываемся в ситуации глубоких социокультурных изменений, вопрос о смыслах и конкретно о целях образования должен быть поставлен заново.",Contrast,но
,"необходимо приблизиться к пониманию реального, объективно существующего смысла ситуации, которая программируется в самой структуре игры.","недостаточно полагаться только на своё собственное восприятие, опыт и компетенцию,",Contrast,no marker
,не утратила своей функциональной активности в речевом пространстве Шалакуши Няндомского района Архангельской области.,"несмотря на изменения в образе жизни современного населения Архангельского Севера,",Concession,несмотря на X
,"Таким образом, наиболее характерными чертами образа идеальной женщины русскоязычного рекламного парфюмерного дискурса являются: привлекательность, сексуальность, женственность, чувственность, элегантность, гламурность, уверенность в себе, неповторимость и уникальность. Большинство вышеперечисленных признаков характерны и для немецкоязычного дискурса. Представления об идеальной женщине также связаны с такими понятиями, как привлекательность, сексуальность, женственность, чувственность, элегантность, уникальность. Приведем примеры: (1) Sexy, feminin und verspielt sorgt Lacoste Touch of Pink bei seiner Trgerin fr stetig gute Stimmung [11]. / Сексуальный, женственный, игривый аромат Touch of Pink позаботиться о хорошем настроении своей «хозяйки». (2) Werden Sie zur erbarmungslosen Verfhrerin und leben Sie Ihre Leidenschaft aus [8]. / Станьте беспощадной искусительницей, дайте волю своей страсти. (3) Dieser Duft ist besonders feminin, edel und elegant [15]. / Этот аромат женственный, благородный и элегантный. (4) Sinnlich duftet die moderne Frau [9]... / Чувственный аромат исходит от современной женщины. (5) Fr originelle Frauen, einzigartige und sexi [14]. / Для оригинальных женщин, неповторимых и сексуальных.","Однако в отличие от русскоязычного рекламного парфюмерного дискурса, для которого данные признаки оказываются наиболее частотными, релевантными признаками женского идеала в немецкоязычной рекламе являются такие качества, как уверенность в себе и независимость: (6) Er ist Begleiter fr die eigenstndige und selbstbewusste Frau [7]. / Он (аромат) сопровождает самостоятельную, уверенную в себе женщину. (7) Lassen Sie sich von diesem wunderbaren Duft verfhren und lernen Sie Ihr Selbstbewusstsein kennen [10]! / Позвольте этому чудесному аромату обольстить вас и почувствовать уверенность в себе! (8) Sein pudriger Duft mit feinen Aromen von Magnolie und Maiglckchen umschmeichelt die selbstbewusste Frau von heute [12]. / Пудровый аромат с тонким благоуханием магнолии и ландыша обольстит уверенную в себе, современную женщину. Идеал современной немецкой женщины в рекламе связан также с такими понятиями, как успешность и лидерство: (9) Diese Frau ist ausdrucksvoll und dominant [7]. / Эта женщина выразительная, задающая тон... (10) Der Duft wurde speziell fr die selbstbewusste, erfolgreiche und moderne Frau entwickelt [13]. / Этот аромат был создан специально для уверенной в себе, успешной, современной женщины. В некоторых случаях подчеркивается смелость и решительность обладательницы аромата: (11) Der Duft fr die mutigen Frauen, die keine Angst haben, ihre Ziele zu verfolgen [10]. / Аромат для смелых женщин, которые не боятся осуществлять задуманное.",Contrast,однако
,"В немецкоязычном дискурсе рекламы парфюмерной продукции также подчеркивается привлекательность, чувственность и сексуальность, чувство стиля и элегантность, а также уникальность и индивидуальность.","Однако в отличие от русскоязычной рекламы мы не обнаружили образов, созданных на основе представлений о гламурной диве, в немецкой рекламе значительно преобладает образ женщины независимой и самостоятельной. При этом образ немецкой идеальной женщины - это не только уверенная в себе и энергичная дама, но и женщина- лидер, занимающая ведущую позицию в обществе.",Contrast,однако
,"В результате проведенного исследования мы пришли к выводу, что одним из наиболее частотных приемов прагматического воздействия на женскую аудиторию является конструирование образа-идеала женщины, обладательницы описываемого аромата.","Однако, сравнивая данные образы, актуализируемые в текстах русскоязычной и немецкоязычной рекламы, нам удалось выявить некоторые различия, обусловленные особенностями двух лингвокультур.",Contrast,однако
,"электронный политический дискурс в гендерном отношении остается практически неизученным,","несмотря на то, что достаточно большое количество исследований посвящено этому типу дискурса вне сетевого общения [цит по: 1].",Concession,несмотря на X
,"Активация таких связей  обусловлена либо осознанием относительно объективных признаков обозначаемого, либо их ассоциативно-образным, оценочным, парадоксальным восприятием номинантами [6, с. 153-180].  Типология мотивационных отношений строится по принципу матрицы, содержащей три параметра.  В зависимости от первого параметра - статуса проекции - выделены следующие типы мотивации: 1) пропозициональная, когда применяются знаки-мотиваторы в прямых значениях, фиксирующие в ономасиологической структуре относительно истинную и непротиворечивую информацию о денотате; 2) ассоциативная, которая характеризуется выбором мотиваторов метафорического статуса на основании связей по аналогии с другими концептуальными сферами знания; 3) модусная, основанная на оценке носителями языка мотиватора в корреляции с психическими функциями ощущений, чувств, архетипами бессознательного; 4) смешанная, которая совмещает мотиваторы, обозначающие различные по статусу фрагменты структуры знаний о денотате; 5) концептуально-интеграционная, когда формируются новый знак и его концепт на основании сочетания двух концептов и их знаков.","Мотивации противопоставлена псевдомотивация, характеризующаяся чисто формальным выбором мотиваторов, семантически и когнитивно не обеспеченных.",Contrast,no marker
