контекст,snippet_x,snippet_y,category_id,маркер
"В России бизнес на протяжении многих лет поставлен в экстремальные условия и всем собственникам бизнеса приходится в них работать. Поэтому не удивительно, что за прошедшие годы реформ и наших тренировок выживания в этих условиях, в бизнесе сформировались свои, российские, принципы управления. Но время идет, а способы решения проблем остаются на уровне середины 90-х годов: все хочется верить в то, что достаточно собрать акционеров, заслушать управляющих менеджеров и принять решение по очередной проблеме. Рынок же, кроме внутренней проработки проблем требует сил и средств для разведки, сбора и обработки многочисленных источников внешней информации. #####","В России бизнес на протяжении многих лет поставлен в экстремальные условия и всем собственникам бизнеса приходится в них работать. Поэтому не удивительно, что за прошедшие годы реформ и наших тренировок выживания в этих условиях, в бизнесе сформировались свои, российские, принципы управления. Но время идет, а способы решения проблем остаются на уровне середины 90-х годов: все хочется верить в то, что достаточно собрать акционеров, заслушать управляющих менеджеров и принять решение по очередной проблеме.","Рынок же, кроме внутренней проработки проблем требует сил и средств для разведки, сбора и обработки многочисленных источников внешней информации.",Contrast,же
"а именно через год запускать надо? На такие рассуждения и обоснование идеи бизнесмен уже не хочет тратить время. Риск, конечно, дело хорошее, куда без него. Но риск риску рознь. Хорошая идея должна не только ""родиться"", но и ""стать на ноги"", чтобы сразу ""делать уверенные шаги"", а на это необходимо время.","Риск, конечно, дело хорошее, куда без него.","Но риск риску рознь. Хорошая идея должна не только ""родиться"", но и ""стать на ноги"", чтобы сразу ""делать уверенные шаги"", а на это необходимо время.",Contrast,но
Тогда это было экзотикой - на российском авторынке признавались только доллары. Но со временем такой подход полностью себя оправдал. Сейчас по тому же пути готовится пойти Ford: руководство российского филиала уже рассматривает подобную схему.,Тогда это было экзотикой - на российском авторынке признавались только доллары.,Но со временем такой подход полностью себя оправдал.,Contrast,но
"Сейчас по тому же пути готовится пойти Ford: руководство российского филиала уже рассматривает подобную схему. В Renault пока размышляют, но тарифы на услуги сервиса уже зафиксировали в евро.","В Renault пока размышляют,",но тарифы на услуги сервиса уже зафиксировали в евро.,Contrast,но
"Тот же концерн BMW реализует в России несколько тысяч машин в год, тогда как на рынке Северной Америки счет продаж идет на сотни тысяч. Естественно, в условиях роста евро цены на баварские автомобили в США, по логике, тоже должны были бы пойти вверх, но этого не происходит. Дело в том, что крупные производители через банки страхуют риски от скачков валютного курса.","Естественно, в условиях роста евро цены на баварские автомобили в США, по логике, тоже должны были бы пойти вверх,",но этого не происходит.,Contrast,но
"а другая германская компания, Porsche, - аж до 2007 года. Подобной предусмотрительности Porsche научил горький опыт прежних лет. Если в 1985 году за один доллар давали 4 марки, то к 1993-му курс германской национальной валюты вырос до 1,35 марки. Porsche,","Если в 1985 году за один доллар давали 4 марки,","то к 1993-му курс германской национальной валюты вырос до 1,35 марки.",Contrast,если ... то
"""Цены на мебель в наших салонах установлены в рублях - так положено по российскому законодательству, но все наши внутренние расчеты мы вот уже полгода ведем исключительно в евро. Мы перешли на эту валюту после того, как ее курс стал сильно расти","""Цены на мебель в наших салонах установлены в рублях - так положено по российскому законодательству,",но все наши внутренние расчеты мы вот уже полгода ведем исключительно в евро.,Contrast,но
"Это подтверждается и данными о движении капитала. Согласно информации Deutsche Bank, за 2002 год в европейские гособлигации инвесторы вложили 52 миллиарда евро, тогда как в 2001-м ситуация была прямо противоположной: тогда из Европы в основном за океан перекочевало 84 миллиарда.","за 2002 год в европейские гособлигации инвесторы вложили 52 миллиарда евро,",тогда как в 2001-м ситуация была прямо противоположной: тогда из Европы в основном за океан перекочевало 84 миллиарда.,Contrast,тогда как
"Действительно, первый замглавы ЦБ Олег Вьюгин на днях поделился именно такими планами, правда, по его словам, золотовалютные резервы будут прирастать не евро единым - в них должна увеличиться доля золота (оно в последнее время устойчиво дорожает) и английских фунтов стерлингов.","Действительно, первый замглавы ЦБ Олег Вьюгин на днях поделился именно такими планами,","правда, по его словам, золотовалютные резервы будут прирастать не евро единым - в них должна увеличиться доля золота (оно в последнее время устойчиво дорожает) и английских фунтов стерлингов.",Contrast,правда
"Столько же в среднем банки платят по рублевым депозитам. Иными словами, хранить сбережения в национальной валюте стало невыгодно - от инфляции эта схема спасает, но заработать не дает. Клиенты банков это прекрасно понимают:","- от инфляции эта схема спасает,",но заработать не дает.,Contrast,но
"Клиенты банков это прекрасно понимают: например, в Банке Москвы ""Итогам"" сообщили, что доля рублевых вкладов граждан неуклонно снижается, а валютные депозиты, наоборот, растут. Вице-президент инвестиционной компании ""Тройка Диалог"" Евгений Гавриленков вообще исключил рубль из своего ""инвестиционного валютного портфеля""","что доля рублевых вкладов граждан неуклонно снижается,","а валютные депозиты, наоборот, растут.",Contrast,а
"Уволиться согласились также заместители губернатора Ровенской области Василия Берташа сам он в настоящее время находится в отпуске) Заявление об отставке под давлением оппозиции написал и львовский губернатор Олег Сало, однако позднее он назвал это заявление недействительным. #####","Заявление об отставке под давлением оппозиции написал и львовский губернатор Олег Сало,",однако позднее он назвал это заявление недействительным.,Contrast,однако
"Сообщается, что они направились на пятый этаж, где находится кабинет губернатора Василия Чуднова. Однако на рабочем месте чиновника не было. По сведениям местного издания Firtka, в кабинете была включена прямая трансляция с митинга, проходящего на улице.","Сообщается, что они направились на пятый этаж, где находится кабинет губернатора Василия Чуднова.",Однако на рабочем месте чиновника не было.,Contrast,однако
"и турникет не работал. ##### Точной информации о погибших и пострадавших полицейских и учителе пока нет. Некоторые источники сообщают о двух раненых полицейских, другие источники — об убитом полицейском, его раненом коллеге и раненом учителе.","Некоторые источники сообщают о двух раненых полицейских,","другие источники — об убитом полицейском, его раненом коллеге и раненом учителе.",Contrast,no marker
"Власти на этом фоне пытаются вести переговоры с оппозицией, они пошли на определенные уступки в частности, было отправлено в отставку правительство) но добиться прекращения противостояния не смогли.","они пошли на определенные уступки в частности, было отправлено в отставку правительство)",но добиться прекращения противостояния не смогли.,Contrast,но
"##### При постройке ступенчатая пирамида в Эдфу была высотой 13 метров, однако за тысячелетия частично разрушилась. Теперь ее высота не превышает пяти метров. Она является одной из семи известных «провинциальных» пирамид,","##### При постройке ступенчатая пирамида в Эдфу была высотой 13 метров,",однако за тысячелетия частично разрушилась.,Contrast,однако
"или при фараоне Снефру (2610-2590 годы до нашей эры). О существовании пирамиды в Эдфу было известно давно, однако работы по ее раскопке были начаты только в 2010 году. ##### Перед началом раскопок пирамида в Эдфу была покрыта толстым слоем песка, мусора и обломков ее же блоков,","О существовании пирамиды в Эдфу было известно давно,",однако работы по ее раскопке были начаты только в 2010 году.,Contrast,однако
"что в стране якобы пройдут досрочные выборы, а также предложили приступить к созданию «народных органов власти». Часть протестующих пыталась пройти к правительственному кварталу, но была остановлена милицейскими кордонами. Начались столкновения,","Часть протестующих пыталась пройти к правительственному кварталу,",но была остановлена милицейскими кордонами.,Contrast,но
"##### Юристы долгое время спорили, квалифицировать дело по 109-й статье или по более тяжкой четвертой части 111-й статьи (причинение тяжкого вреда здоровью, повлекшего смерть потерпевшего) Обычно в аналогичных случаях применяется 109-я статья, однако некоторые эксперты утверждали, что как спортсмен Мирзаев обязан был предвидеть последствия своих действий.","Обычно в аналогичных случаях применяется 109-я статья,","однако некоторые эксперты утверждали, что как спортсмен Мирзаев обязан был предвидеть последствия своих действий.",Contrast,однако
"Поводом для перевода зонда в «спячку» стала недостаточная для работы приборов мощность аккумуляторов. В сентябре 2012 года «Розетта» достигла орбиты Юпитера, однако этой планеты зонд не «увидел». #####","В сентябре 2012 года «Розетта» достигла орбиты Юпитера,",однако этой планеты зонд не «увидел».,Contrast,однако
"и скачивать с его помощью музыку» заявил Дотком. По его словам, Baboom станет своего рода «сочетанием iTunes и сервиса Spotify», однако будет использовать более справедливую модель распределения прибыли между музыкантами и правообладателями. ##### Ранее проживающий в Новой Зеландии Ким Дотком намеревался объявить","По его словам, Baboom станет своего рода «сочетанием iTunes и сервиса Spotify»,",однако будет использовать более справедливую модель распределения прибыли между музыкантами и правообладателями.,Contrast,однако
"По словам Карпина, поездка в Мюнхен оказалась для него очень полезной. ##### Карпин сказал, что в тактике «Спартака» и «Баварии» есть сходства, однако его подход не во всем совпадает с подходом Гвардиолы. Так, по словам наставника «Спартака», тренер «Баварии» хочет добиться того,","что в тактике «Спартака» и «Баварии» есть сходства,",однако его подход не во всем совпадает с подходом Гвардиолы.,Contrast,однако
"Так, по словам наставника «Спартака», тренер «Баварии» хочет добиться того, чтобы его игроки почти не использовали контратаки, а спартаковцы от контратак отказываться не собираются. Карпин также отметил, что у «Барселоны»,","Так, по словам наставника «Спартака», тренер «Баварии» хочет добиться того, чтобы его игроки почти не использовали контратаки,",а спартаковцы от контратак отказываться не собираются.,Contrast,а
"Карпин также отметил, что у «Барселоны», когда ее тренировал Гвардиола, «практически не было» позиционной обороны, и сейчас «Бавария» стремится к тому же. В игре «Спартака», по словам Карпина, позиционная оборона присутствует. ##### Также в интервью «Чемпионат.com» Карпин выразил уверенность, что «Спартак» под его руководством станет чемпионом России уже в сезоне-2013/14.","Карпин также отметил, что у «Барселоны», когда ее тренировал Гвардиола, «практически не было» позиционной обороны, и сейчас «Бавария» стремится к тому же.","В игре «Спартака», по словам Карпина, позиционная оборона присутствует.",Contrast,no marker
"##### Фармацевтические препараты - не безусловное благо. С одной стороны, они спасают людям жизнь, а с другой - нередко становятся причиной новых болезней. Между тем во многих случаях нет необходимости прибегать к сильнодействующим химическим веществам,","С одной стороны, они спасают людям жизнь,",а с другой - нередко становятся причиной новых болезней.,Contrast,с одной стороны... а с другой
"что он не имел даже фельдшерского образования. Для современной медицины важно не только и не столько то, когда зародились тот или иной метод или средство и как это все называть, а их суть и опыт применения (не только позитивный). ##### ФИТОТЕРАПИЯ СЕГОДНЯ.","не только и не столько то, когда зародились тот или иной метод или средство и как это все называть,",а их суть и опыт применения (не только позитивный).,Contrast,не только... а
"Причина проста: финансовый кризис Лишил его валютных резервов, а без них наш главный банк - лишь контора по производству инструкций. Получив закон, ЦБ приступил к массированной закупке валюты у экспортеров.","финансовый кризис Лишил его валютных резервов,",а без них наш главный банк - лишь контора по производству инструкций.,Contrast,а
"стало неуютно отгонять деньги за рубеж по-серому. Побаиваются власти. Хочется по-белому - культурно, прилично. Но даже это сделать будет нелегко. Поскольку на Западе под любыми предлогами препятствуют открытию таких счетов.","Хочется по-белому - культурно, прилично.",Но даже это сделать будет нелегко.,Contrast,но
"Но даже это сделать будет нелегко. Поскольку на Западе под любыми предлогами препятствуют открытию таких счетов. ""Съесть-то он съест, да кто ж ему даст""? Именно так.","""Съесть-то он съест,","да кто ж ему даст""?",Contrast,да
"которое до сих пор не вернуло ему более $6 млрд. ##### Казалось бы, чего еще желать. Но в экономике все имеет свою цену. Откупая валюту с рынка, ЦБ запускает в хозяйство дополнительные рубли.","##### Казалось бы, чего еще желать.",Но в экономике все имеет свою цену.,Contrast,но
"Откупая валюту с рынка, ЦБ запускает в хозяйство дополнительные рубли. Их количество зависит от потока экспортной выручки, прежде всего от объема нефтедолларов. А не от того, сколько денег нужно экономике. Так что возможен перебор.","Их количество зависит от потока экспортной выручки, прежде всего от объема нефтедолларов.","А не от того, сколько денег нужно экономике.",Contrast,а
"Если экспортер заработал валюту, то в принципе должен иметь возможность распорядиться ею по собственному усмотрению. А ему не дают. Наконец, обязательная продажа валютной выручки - норма все же экзотическая. Применяется разве что на пространствах СНГ.","Если экспортер заработал валюту, то в принципе должен иметь возможность распорядиться ею по собственному усмотрению.",А ему не дают.,Contrast,а
"расход побольше. Может быть, и тройную. Хотя правительство наотрез отказывается занимать у ЦБ для платежей по внешнему долгу, трудно сказать, как пойдут дела в будущем. Ну а если припрет?","Хотя правительство наотрез отказывается занимать у ЦБ для платежей по внешнему долгу,","трудно сказать, как пойдут дела в будущем.",Contrast,хотя
